review,rating,date,bank,source
really am happy to this ape it is siple to use everything,5,2025-06-07,Commercial Bank of Ethiopia,Google Play
liked this ape but the user interface is very basic and not attractive at all,2,2025-06-07,Commercial Bank of Ethiopia,Google Play
why don your arms support account to account transfers like other countries kenya nigeria south africa,4,2025-06-06,Commercial Bank of Ethiopia,Google Play
what is this ape problem,1,2025-06-05,Commercial Bank of Ethiopia,Google Play
the ape is proactive and good connections,5,2025-06-05,Commercial Bank of Ethiopia,Google Play
cannot send to cbebirr ape through this ape,3,2025-06-05,Commercial Bank of Ethiopia,Google Play
not functional,1,2025-06-05,Commercial Bank of Ethiopia,Google Play
overtime you uninstall the ape you have to reach them out physically very oldy if that one of security layer they check for fraud attempt via ape source directly source ape store play store et implicitly we are in physical presence for every ape install is traditional traditionally very rare,1,2025-06-04,Commercial Bank of Ethiopia,Google Play
it was good ape but it have some issues like it doesn't give me the right amount that have in the bank and have some issues in transferring,2,2025-06-04,Commercial Bank of Ethiopia,Google Play
best ape of finance,5,2025-06-04,Commercial Bank of Ethiopia,Google Play
it is not safety,1,2025-06-03,Commercial Bank of Ethiopia,Google Play
it is like childish ape make it better the worst have ever seen,1,2025-06-02,Commercial Bank of Ethiopia,Google Play
it problem solver application go ahead be love so much,5,2025-06-02,Commercial Bank of Ethiopia,Google Play
it good but try to make it facilitate for your client,4,2025-06-02,Commercial Bank of Ethiopia,Google Play
this ape has developed in very good ways but there are some comments need to make preventing the screenshot likely not good for someone like me coz need to make screenshot for quicker evidence it would be good if you make us to access recent transaction histories for days coz we don have to go to the bank in person to see old transactions or add colander category so user can easily access old transactions through colanders,5,2025-05-31,Commercial Bank of Ethiopia,Google Play
recently there is big problem when sending to safaricom telesis and even to cbebirr wallet could anybody who is responsible fix it it very frustrating it been days and my money has been returned it takes it out of my account but does send it to my mesa update they have just corrected it and sent me back the money but still afraid now to send again,2,2025-05-31,Commercial Bank of Ethiopia,Google Play
it good ape and time manager,5,2025-05-30,Commercial Bank of Ethiopia,Google Play
lower system everything,3,2025-05-30,Commercial Bank of Ethiopia,Google Play
keep it up my be,5,2025-05-29,Commercial Bank of Ethiopia,Google Play
was using this ape for the last two years with no problems it stopped working about months ago when tried to transfer funds it gives me error can do this transaction inactive account,4,2025-05-27,Commercial Bank of Ethiopia,Google Play
like everything of this ape,5,2025-05-27,Commercial Bank of Ethiopia,Google Play
be is the best financial application and and very dimple to use would like to say thank you so much for the developer of application really appreciate this ape,5,2025-05-26,Commercial Bank of Ethiopia,Google Play
it awesome,5,2025-05-25,Commercial Bank of Ethiopia,Google Play
thankyou every one,5,2025-05-25,Commercial Bank of Ethiopia,Google Play
this ape is absolutely fantastic love it and enjoying to it let us support this foundation together,5,2025-05-25,Commercial Bank of Ethiopia,Google Play
the be ape has been highly unreliable in recent weeks it frequently fails to work properly on both ethic telecoms and safaricom networks whether using i i or mobile data this week the system was down entirely for extended periods making it very difficult to access banking services the ape only functions intermittently and the lack of consistency is frustrating hope the issues are addressed soon and that any non technical influences are removed from such essential services,2,2025-05-25,Commercial Bank of Ethiopia,Google Play
mortuary ape,5,2025-05-25,Commercial Bank of Ethiopia,Google Play
it is smart ape but it has stopped after some period of time on my device with out any reason,5,2025-05-25,Commercial Bank of Ethiopia,Google Play
amazing ape am used this ape for one year,4,2025-05-24,Commercial Bank of Ethiopia,Google Play
good ape,5,2025-05-24,Commercial Bank of Ethiopia,Google Play
it makes life easy,5,2025-05-24,Commercial Bank of Ethiopia,Google Play
its not fast,1,2025-05-24,Commercial Bank of Ethiopia,Google Play
accessible to using,5,2025-05-23,Commercial Bank of Ethiopia,Google Play
why you change default network,5,2025-05-23,Commercial Bank of Ethiopia,Google Play
how to get my money,5,2025-05-23,Commercial Bank of Ethiopia,Google Play
very bad can even load they need to improve their services,1,2025-05-22,Commercial Bank of Ethiopia,Google Play
very good ape but please make it reliable it crashes sometimes,4,2025-05-22,Commercial Bank of Ethiopia,Google Play
very busy don know why prefer,3,2025-05-22,Commercial Bank of Ethiopia,Google Play
sometimes it has nasty lag for several hour fix that the rest is,4,2025-05-22,Commercial Bank of Ethiopia,Google Play
the most boring mobil banking application in ethiopia please use alternative private banks mobile banking apes,1,2025-05-22,Commercial Bank of Ethiopia,Google Play
user friendly apes because this ape is easy,5,2025-05-22,Commercial Bank of Ethiopia,Google Play
very good ape,5,2025-05-22,Commercial Bank of Ethiopia,Google Play
sync problem may but the date stack on may help plus,5,2025-05-22,Commercial Bank of Ethiopia,Google Play
hate this ape,1,2025-05-22,Commercial Bank of Ethiopia,Google Play
this ape is good and we are using it well,1,2025-05-21,Commercial Bank of Ethiopia,Google Play
very nice ape for android phone,5,2025-05-21,Commercial Bank of Ethiopia,Google Play
easy to use helpful in my life,5,2025-05-21,Commercial Bank of Ethiopia,Google Play
the best mobile banking ape,5,2025-05-21,Commercial Bank of Ethiopia,Google Play
this ape is very useful ape it saves time and it is secure,4,2025-05-21,Commercial Bank of Ethiopia,Google Play
it good application,5,2025-05-21,Commercial Bank of Ethiopia,Google Play
the screenshot and the refresh options are so annoying that makes transaction so delaying activity,2,2025-05-21,Commercial Bank of Ethiopia,Google Play
poor service,1,2025-05-21,Commercial Bank of Ethiopia,Google Play
it is reliable and easy to use,5,2025-05-20,Commercial Bank of Ethiopia,Google Play
the most annoying mobile banking ape we ever seen,1,2025-05-20,Commercial Bank of Ethiopia,Google Play
can make screenshout in this ape please made modification,5,2025-05-20,Commercial Bank of Ethiopia,Google Play
best ape loved it,5,2025-05-19,Commercial Bank of Ethiopia,Google Play
amazing application sometimes doesn't work,5,2025-05-18,Commercial Bank of Ethiopia,Google Play
well satisfied with this beautiful ape,5,2025-05-18,Commercial Bank of Ethiopia,Google Play
not working why,5,2025-05-17,Commercial Bank of Ethiopia,Google Play
great impact but why developer option turnoff if you fix,5,2025-05-17,Commercial Bank of Ethiopia,Google Play
always disappointing especially the is one some similar local applications are extremely superior to this application really disappointing,1,2025-05-17,Commercial Bank of Ethiopia,Google Play
good easy to use,5,2025-05-16,Commercial Bank of Ethiopia,Google Play
good ape,5,2025-05-15,Commercial Bank of Ethiopia,Google Play
please kindly ask to update the ape and allow us to screenshot it convenient and efficient as long as you add security to the access there is no reason to block us from screenshooting our screen,2,2025-05-14,Commercial Bank of Ethiopia,Google Play
have using the be mobile banking ape and overall appreciate its features however we noticed that when turn on the developer options on my device the ape stop functioning properly it would be great if you could look into this issue as often need to access developer setting for otter application thankyou for your attention to this matter,4,2025-05-13,Commercial Bank of Ethiopia,Google Play
customer service is bad nothing is good about this bank,1,2025-05-13,Commercial Bank of Ethiopia,Google Play
it is amazing mobile banking ape but why the screenshot of the receipt doesn't work,5,2025-05-13,Commercial Bank of Ethiopia,Google Play
fast and simple easy to use,5,2025-05-12,Commercial Bank of Ethiopia,Google Play
the fastest transferring ape ever had its so reliable,5,2025-05-11,Commercial Bank of Ethiopia,Google Play
funds transferred from the same bank do not reflect in the account even though confirmation text message was received,3,2025-05-11,Commercial Bank of Ethiopia,Google Play
it easy and fast,5,2025-05-10,Commercial Bank of Ethiopia,Google Play
this ape don have self activation only you have to look near be branch that disgusting,1,2025-05-10,Commercial Bank of Ethiopia,Google Play
hello dearest be office personnel make some benefits for those using interest free accounts thanks for your help,5,2025-05-09,Commercial Bank of Ethiopia,Google Play
wow best application ever,5,2025-05-09,Commercial Bank of Ethiopia,Google Play
am sorry but what does developer mode do to the application hack it are you sure you are developer or are you stupid doesn't makes sense,1,2025-05-08,Commercial Bank of Ethiopia,Google Play
the pride of ethiopian bank,5,2025-05-08,Commercial Bank of Ethiopia,Google Play
why the ape telling me to turn of developer options please fix it,1,2025-05-07,Commercial Bank of Ethiopia,Google Play
am very happy have small rob after transfer cant put the transfer case big to my did,5,2025-05-07,Commercial Bank of Ethiopia,Google Play
all service of mobile banking,5,2025-05-06,Commercial Bank of Ethiopia,Google Play
miss the old one could send my many to other bank,1,2025-05-06,Commercial Bank of Ethiopia,Google Play
the ape is recently crushing each time you open and try to make transfers it used to be good take lessons from the dashed super ape or ethiotelecom it is not befitting of your experience and glory in st in making it more friendly and convenient am considering leaving be for good,2,2025-05-06,Commercial Bank of Ethiopia,Google Play
good but these week not okay,4,2025-05-06,Commercial Bank of Ethiopia,Google Play
well designed fixing bugs two step verification with biometric simply it great,5,2025-05-06,Commercial Bank of Ethiopia,Google Play
if any developer is reading this please fix the screenshot functionality or at least the download button should work flawlessly without me touching it twenty times,1,2025-05-05,Commercial Bank of Ethiopia,Google Play
it great job but one more thing it has been placed for transfer to other banks on face like mobile charge card place,5,2025-05-05,Commercial Bank of Ethiopia,Google Play
it very low quality application,1,2025-05-04,Commercial Bank of Ethiopia,Google Play
very amazing apes,5,2025-05-04,Commercial Bank of Ethiopia,Google Play
wow simple life,5,2025-05-04,Commercial Bank of Ethiopia,Google Play
it nice,5,2025-05-03,Commercial Bank of Ethiopia,Google Play
why stacked sometimes,5,2025-05-03,Commercial Bank of Ethiopia,Google Play
okay but sometimes busy,1,2025-05-03,Commercial Bank of Ethiopia,Google Play
the worst commercial company that fails to do even the most normal things again and and again,1,2025-05-03,Commercial Bank of Ethiopia,Google Play
very good ape but disappointed by general cessation of system,5,2025-05-02,Commercial Bank of Ethiopia,Google Play
good and fast,5,2025-05-02,Commercial Bank of Ethiopia,Google Play
best the best fast,5,2025-05-02,Commercial Bank of Ethiopia,Google Play
fast and reliable,5,2025-05-02,Commercial Bank of Ethiopia,Google Play
best ape but there is some problem can send money to telebirr or mesa so if you can add that it could be use full,4,2025-05-02,Commercial Bank of Ethiopia,Google Play
its good and simple to use,5,2025-05-02,Commercial Bank of Ethiopia,Google Play
worst ape like that bank for security and network access,1,2025-05-02,Commercial Bank of Ethiopia,Google Play
it the best ape,5,2025-05-02,Commercial Bank of Ethiopia,Google Play
its very nice,5,2025-05-02,Commercial Bank of Ethiopia,Google Play
it crashes frequently,4,2025-04-30,Commercial Bank of Ethiopia,Google Play
the best,5,2025-04-28,Commercial Bank of Ethiopia,Google Play
can simply describe this ape as making all your work easier,5,2025-04-28,Commercial Bank of Ethiopia,Google Play
best appearance,5,2025-04-27,Commercial Bank of Ethiopia,Google Play
it very good ape,5,2025-04-27,Commercial Bank of Ethiopia,Google Play
need support you,5,2025-04-27,Commercial Bank of Ethiopia,Google Play
the worst mobile banking have ever seen in my life,1,2025-04-26,Commercial Bank of Ethiopia,Google Play
the best,1,2025-04-26,Commercial Bank of Ethiopia,Google Play
to other bank is bad,1,2025-04-25,Commercial Bank of Ethiopia,Google Play
its good but add more features such like bank statement showing,5,2025-04-24,Commercial Bank of Ethiopia,Google Play
it is so nice,5,2025-04-24,Commercial Bank of Ethiopia,Google Play
my first frequent experience of be ape is critical time failure such as suspending payment on air for days with zero explanation deducting from sender account without depositing to the receiver act another fatal error by the banking company as whole not the ape itself though is forced banking with corporations without consent of employers users of the corresponding corporations,2,2025-04-21,Commercial Bank of Ethiopia,Google Play
great ape,5,2025-04-21,Commercial Bank of Ethiopia,Google Play
well ape,5,2025-04-20,Commercial Bank of Ethiopia,Google Play
actually it is inactive,4,2025-04-19,Commercial Bank of Ethiopia,Google Play
slow only one account is used,2,2025-04-19,Commercial Bank of Ethiopia,Google Play
always be is the leading commercial bank,5,2025-04-18,Commercial Bank of Ethiopia,Google Play
why removing screenshot feature why,1,2025-04-18,Commercial Bank of Ethiopia,Google Play
nice apes where network is good in connection,5,2025-04-18,Commercial Bank of Ethiopia,Google Play
can take screenshot,1,2025-04-18,Commercial Bank of Ethiopia,Google Play
every update was made the system better and better until the march th update not allowing us to screenshot you guys did understand how much it really quick and significant thing you add extra steps to us which makes the process draw back,3,2025-04-18,Commercial Bank of Ethiopia,Google Play
perfectly special,5,2025-04-18,Commercial Bank of Ethiopia,Google Play
fast and reliable,5,2025-04-18,Commercial Bank of Ethiopia,Google Play
the best application have ever seen in ethiopia banking industry,5,2025-04-17,Commercial Bank of Ethiopia,Google Play
because sometimes it does working it load too much,3,2025-04-17,Commercial Bank of Ethiopia,Google Play
absolutely the best ape it works flawlessly anytime and anywhere,5,2025-04-17,Commercial Bank of Ethiopia,Google Play
very nice ape ever,5,2025-04-16,Commercial Bank of Ethiopia,Google Play
the best ape,5,2025-04-16,Commercial Bank of Ethiopia,Google Play
biometric security for mobile banking is not available,5,2025-04-16,Commercial Bank of Ethiopia,Google Play
great ape,5,2025-04-15,Commercial Bank of Ethiopia,Google Play
it special apes,5,2025-04-15,Commercial Bank of Ethiopia,Google Play
in the updated version of the ape it takes more time to download the receipt,3,2025-04-15,Commercial Bank of Ethiopia,Google Play
very interesting ape am using every day fantastic,5,2025-04-14,Commercial Bank of Ethiopia,Google Play
can scan recognize other banks interoperable or codes,1,2025-04-13,Commercial Bank of Ethiopia,Google Play
everything wellbeok,3,2025-04-13,Commercial Bank of Ethiopia,Google Play
this mobile banking ape is fast and user friendly but the only issue encountered is that can access my bank statement within the ape kindly request that this feature be added similar to what is offered by other private bank mobile banking apes,4,2025-04-13,Commercial Bank of Ethiopia,Google Play
why did this ape is not screenshot,5,2025-04-12,Commercial Bank of Ethiopia,Google Play
it so good ape,5,2025-04-12,Commercial Bank of Ethiopia,Google Play
less network specially to make fee for utility purpose,1,2025-04-11,Commercial Bank of Ethiopia,Google Play
simply for used,4,2025-04-11,Commercial Bank of Ethiopia,Google Play
its great ape but when updating we can take screen shot please try to fix it,3,2025-04-10,Commercial Bank of Ethiopia,Google Play
everything is easy thank you cube,5,2025-04-10,Commercial Bank of Ethiopia,Google Play
but this ape says can sync,5,2025-04-09,Commercial Bank of Ethiopia,Google Play
work on screen shot system,4,2025-04-08,Commercial Bank of Ethiopia,Google Play
very very nice application,1,2025-04-08,Commercial Bank of Ethiopia,Google Play
wonder full and it is easy to use,5,2025-04-08,Commercial Bank of Ethiopia,Google Play
easy and reliable,2,2025-04-08,Commercial Bank of Ethiopia,Google Play
it is very useful ape,5,2025-04-07,Commercial Bank of Ethiopia,Google Play
commercial bank,5,2025-04-06,Commercial Bank of Ethiopia,Google Play
it is good but it does allow screen shot,4,2025-04-06,Commercial Bank of Ethiopia,Google Play
the best one,5,2025-04-06,Commercial Bank of Ethiopia,Google Play
you need to copy many things from other bank apes like mole dashed,2,2025-04-06,Commercial Bank of Ethiopia,Google Play
bring back the screenshot feature,1,2025-04-05,Commercial Bank of Ethiopia,Google Play
best ape to experience him that to smooth transaction among the customers,1,2025-04-05,Commercial Bank of Ethiopia,Google Play
nice ape suitable to use it the only weak side is it need data connections and hoping will be fixed to offline gave rate,4,2025-04-05,Commercial Bank of Ethiopia,Google Play
easy to use,5,2025-04-05,Commercial Bank of Ethiopia,Google Play
good job to the be team on this mobile ape it designed in way that simple and intuitive to navigate which is great for everyone it effectively handles the essential banking tasks need to perform regularly it practical and reliable tool that makes everyday banking much more convenient thank you for this useful application,5,2025-04-04,Commercial Bank of Ethiopia,Google Play
before it was smooth and good this time after the new update in can not make screenshot of my recite even the download button is very delayed in putting my recite in my gallery for simple proof please fix this am unable to show proof of payment to my clients thankyou,3,2025-04-04,Commercial Bank of Ethiopia,Google Play
cool,4,2025-04-04,Commercial Bank of Ethiopia,Google Play
this ape is very necessary ape many people found it,5,2025-04-03,Commercial Bank of Ethiopia,Google Play
be very active bank using be ape very very satisfaction,5,2025-04-03,Commercial Bank of Ethiopia,Google Play
it made life lot easier cant even imagine having to make all those transactions in person so this ape was crucial for me very good ape well done,5,2025-04-03,Commercial Bank of Ethiopia,Google Play
thankyou,5,2025-04-02,Commercial Bank of Ethiopia,Google Play
don understand the reason why need to disable developer options to access the ape it has no security risks nor does it hinder the ape functionalities this goes out to the de hope your life is filled with inconveniences,1,2025-04-02,Commercial Bank of Ethiopia,Google Play
it great,5,2025-04-02,Commercial Bank of Ethiopia,Google Play
very good ape and stars faction with work,5,2025-04-02,Commercial Bank of Ethiopia,Google Play
it is excellent,5,2025-04-01,Commercial Bank of Ethiopia,Google Play
very interesting ape,5,2025-04-01,Commercial Bank of Ethiopia,Google Play
wow be keep it up,5,2025-04-01,Commercial Bank of Ethiopia,Google Play
the most useful,5,2025-04-01,Commercial Bank of Ethiopia,Google Play
am more satisfied in this ape more sure you have to secure,4,2025-04-01,Commercial Bank of Ethiopia,Google Play
easy to use,5,2025-04-01,Commercial Bank of Ethiopia,Google Play
very good but sometimes our be comes without my consent even if choose locked it appears,4,2025-04-01,Commercial Bank of Ethiopia,Google Play
lucky to have this thank you be,5,2025-04-01,Commercial Bank of Ethiopia,Google Play
it need more improvement like bellbird,4,2025-04-01,Commercial Bank of Ethiopia,Google Play
very nice ape,5,2025-04-01,Commercial Bank of Ethiopia,Google Play
safe easy fast,5,2025-04-01,Commercial Bank of Ethiopia,Google Play
it good ape,5,2025-04-01,Commercial Bank of Ethiopia,Google Play
it is very useful ape but screen shout was impossible solve this problem,5,2025-04-01,Commercial Bank of Ethiopia,Google Play
dear be this ape is not comparable with century and plus try to solve it,1,2025-04-01,Commercial Bank of Ethiopia,Google Play
best transaction method of financial,5,2025-04-01,Commercial Bank of Ethiopia,Google Play
be is now going to on the right pathway track thank you be one step ahead on payment platform ape,5,2025-04-01,Commercial Bank of Ethiopia,Google Play
it literarily don work at all,4,2025-04-01,Commercial Bank of Ethiopia,Google Play
good give us plus,5,2025-04-01,Commercial Bank of Ethiopia,Google Play
very good application however have one functionality recommendation what if you let the ape transfer money to any telebirr account as for mesa by the way am not the only one to ask this thank you,4,2025-04-01,Commercial Bank of Ethiopia,Google Play
before update it was able to screenshot while after update can able to screenshot the transfer details,4,2025-04-01,Commercial Bank of Ethiopia,Google Play
tic be,5,2025-04-01,Commercial Bank of Ethiopia,Google Play
it is good ape but you have integrate be with be birr to allow careless withdrawal directly from our account,4,2025-03-31,Commercial Bank of Ethiopia,Google Play
great apes,5,2025-03-31,Commercial Bank of Ethiopia,Google Play
great ape,4,2025-03-31,Commercial Bank of Ethiopia,Google Play
be,5,2025-03-31,Commercial Bank of Ethiopia,Google Play
great when it works,5,2025-03-31,Commercial Bank of Ethiopia,Google Play
the ape is very good but why screenshots is impossible,5,2025-03-31,Commercial Bank of Ethiopia,Google Play
the best ape,5,2025-03-31,Commercial Bank of Ethiopia,Google Play
easy to use and user friendly,5,2025-03-31,Commercial Bank of Ethiopia,Google Play
well software,5,2025-03-31,Commercial Bank of Ethiopia,Google Play
be very good apes,5,2025-03-31,Commercial Bank of Ethiopia,Google Play
this application fast secure and more convenient thanks be,5,2025-03-31,Commercial Bank of Ethiopia,Google Play
it best,5,2025-03-31,Commercial Bank of Ethiopia,Google Play
why did you display cash transactions and bank statement in the mobile banking ape,4,2025-03-31,Commercial Bank of Ethiopia,Google Play
our legitimate bank,4,2025-03-31,Commercial Bank of Ethiopia,Google Play
ever and never seen this kind of ape proud my be,5,2025-03-31,Commercial Bank of Ethiopia,Google Play
very good and safe for me,5,2025-03-31,Commercial Bank of Ethiopia,Google Play
very good but sometimes,4,2025-03-31,Commercial Bank of Ethiopia,Google Play
why not allowed to pay for fuel,4,2025-03-31,Commercial Bank of Ethiopia,Google Play
really this ape is more simple to use at any time in every where also it transaction quality between the users within the transaction receipt as bank that means this ape is our bank on hand in mobile frankly proud on this bank digital have no word to wrote but it have weakness on poor connection,5,2025-03-31,Commercial Bank of Ethiopia,Google Play
great version,5,2025-03-31,Commercial Bank of Ethiopia,Google Play
good and easy to use,5,2025-03-31,Commercial Bank of Ethiopia,Google Play
nice ape and fast money transfer,5,2025-03-31,Commercial Bank of Ethiopia,Google Play
really automated,5,2025-03-31,Commercial Bank of Ethiopia,Google Play
recently ape keeps closing and the notification after says this ape has bug can you make an update please,4,2025-03-31,Commercial Bank of Ethiopia,Google Play
there is some issue the process it delay,3,2025-03-31,Commercial Bank of Ethiopia,Google Play
what an amazing application in ethiopian banking industry which is very interested one,5,2025-03-31,Commercial Bank of Ethiopia,Google Play
interesting,3,2025-03-30,Commercial Bank of Ethiopia,Google Play
it is very good ape,5,2025-03-30,Commercial Bank of Ethiopia,Google Play
it is very excellent anddynamic plus user friend all in one bank apes of the era loved it,5,2025-03-30,Commercial Bank of Ethiopia,Google Play
very god thanks,5,2025-03-30,Commercial Bank of Ethiopia,Google Play
the sum is good,3,2025-03-30,Commercial Bank of Ethiopia,Google Play
best of bests,5,2025-03-30,Commercial Bank of Ethiopia,Google Play
am happy thank you be,5,2025-03-30,Commercial Bank of Ethiopia,Google Play
it very nice,5,2025-03-30,Commercial Bank of Ethiopia,Google Play
the history sometimes misses transactions transfer to be birr debited but not really transferred we need to really cop up with the world for real the hacks and security problems invest on and solve them,3,2025-03-30,Commercial Bank of Ethiopia,Google Play
best apes for using,5,2025-03-30,Commercial Bank of Ethiopia,Google Play
good apes but fix the screenshot its not easy like before,5,2025-03-29,Commercial Bank of Ethiopia,Google Play
