review,rating,date,bank,source
this ape is best and fantastic because easy to use it has best security specially two specific authentication so this security is not path unauthorized person to our account history thankyou be for we give this service,5,2025-02-04,Commercial Bank of Ethiopia,Google Play
the ape is crashing several times it really annoying and sometimes it says failed during different operations please fix it,1,2025-02-04,Commercial Bank of Ethiopia,Google Play
new update new version not working,1,2025-02-03,Commercial Bank of Ethiopia,Google Play
that is good,5,2025-02-03,Commercial Bank of Ethiopia,Google Play
have seen lots of great updates right here especially the fa using the biometric security technique suggest you work on minimizing ape crashing due to the accumulation of cache very little cache crash it,4,2025-02-03,Commercial Bank of Ethiopia,Google Play
the best mobile banking ape in ethiopia thanks be,5,2025-02-03,Commercial Bank of Ethiopia,Google Play
be,5,2025-02-03,Commercial Bank of Ethiopia,Google Play
too poor comparing to other countries,1,2025-02-03,Commercial Bank of Ethiopia,Google Play
it is good,5,2025-02-02,Commercial Bank of Ethiopia,Google Play
updated to the new version while ago and it keeps crashing maybe you can fix it,3,2025-02-02,Commercial Bank of Ethiopia,Google Play
simple good ape,4,2025-02-02,Commercial Bank of Ethiopia,Google Play
after the last two update am facing the worst experience with this ape,1,2025-02-02,Commercial Bank of Ethiopia,Google Play
now it crashing like crazy it does even open after recent update,1,2025-02-01,Commercial Bank of Ethiopia,Google Play
this ape is so incredible,5,2025-02-01,Commercial Bank of Ethiopia,Google Play
mobil banking is the latest technology,5,2025-02-01,Commercial Bank of Ethiopia,Google Play
without any reason it shows white screen and can make transfers then when went to branch then they reply go to the branch where you open your account,1,2025-02-01,Commercial Bank of Ethiopia,Google Play
it used to be the best bank ape in ethiopia but now using it is terrible experience for every transaction it shows an error message making simple payment requires to trials to complete,1,2025-01-31,Commercial Bank of Ethiopia,Google Play
good application,5,2025-01-31,Commercial Bank of Ethiopia,Google Play
the worst had to flight back to fix my ape it need you to go back every month not reliable for foreigners,1,2025-01-31,Commercial Bank of Ethiopia,Google Play
this should run for worst ape of the year,1,2025-01-31,Commercial Bank of Ethiopia,Google Play
very bad,1,2025-01-31,Commercial Bank of Ethiopia,Google Play
it is nice ape,4,2025-01-31,Commercial Bank of Ethiopia,Google Play
very nice ape,5,2025-01-31,Commercial Bank of Ethiopia,Google Play
it easy to use but there is some problems sometimes when update the ape in the network areas,4,2025-01-31,Commercial Bank of Ethiopia,Google Play
no manage beneficiary for my ape,1,2025-01-30,Commercial Bank of Ethiopia,Google Play
its good but we need an option of choosing specific period to get historique of transactions for example when want to check my previous transactions only get few transactions thank you,2,2025-01-30,Commercial Bank of Ethiopia,Google Play
very good mobile ape,5,2025-01-30,Commercial Bank of Ethiopia,Google Play
something is wrong with the new update it keep closing itself and could made an important transaction,3,2025-01-30,Commercial Bank of Ethiopia,Google Play
the latest updates crushes repeatedly on my red note pro plus if you could correct the issue,1,2025-01-30,Commercial Bank of Ethiopia,Google Play
we been using the be mobile banking ape and overall appreciate its features however we noticed that when turn on the developer options on my device the ape stops functioning properly it would be great if you could look into this issue as often need to access developer settings for other applications thank you for your attention to this matter,1,2025-01-29,Commercial Bank of Ethiopia,Google Play
like the ape,5,2025-01-29,Commercial Bank of Ethiopia,Google Play
if you are living outside of ethiopia you better not deposit large money into your mobile account it can kick you off any time for some small reasons and the only way you can recover is either to go to the bank in person or you need to have access to your phone which is impossible if you are living outside ethiopia the only option you will be left with is you can use your money at least it would be better if you can recover your account using email or other verification,1,2025-01-29,Commercial Bank of Ethiopia,Google Play
number one,5,2025-01-29,Commercial Bank of Ethiopia,Google Play
updating the ape is must overtime they release it even to reload the transaction,2,2025-01-29,Commercial Bank of Ethiopia,Google Play
these ape is beast but the new update is great,5,2025-01-29,Commercial Bank of Ethiopia,Google Play
it easy and user friendly,5,2025-01-29,Commercial Bank of Ethiopia,Google Play
it is helpful to save time and energy,5,2025-01-28,Commercial Bank of Ethiopia,Google Play
digital leader bank in ethiopia be,5,2025-01-28,Commercial Bank of Ethiopia,Google Play
turning off the developers options this is getting out of hand we don need to go through that,1,2025-01-28,Commercial Bank of Ethiopia,Google Play
don have an idea why our country soft wares needs some beroucracy how many peoples knew that about developer options why is the new ape forcing to disable that in my side did get the apes as of,1,2025-01-28,Commercial Bank of Ethiopia,Google Play
best ape ever but when be be integrated with international transfer,5,2025-01-28,Commercial Bank of Ethiopia,Google Play
where ever you go no one is like be mobile banking it absolutely perfect,5,2025-01-28,Commercial Bank of Ethiopia,Google Play
does it give you list of beneficiaries,2,2025-01-27,Commercial Bank of Ethiopia,Google Play
transaction history needs to be more,2,2025-01-27,Commercial Bank of Ethiopia,Google Play
this ape is more helpful and best,5,2025-01-27,Commercial Bank of Ethiopia,Google Play
like it more the ape be thank you,5,2025-01-27,Commercial Bank of Ethiopia,Google Play
alert the device developer mode is turned on please turn off developer mode from device settings and try again to use this ape ok what is this,1,2025-01-27,Commercial Bank of Ethiopia,Google Play
correct your order of incoming and outgoing birr,3,2025-01-27,Commercial Bank of Ethiopia,Google Play
nice ape,5,2025-01-27,Commercial Bank of Ethiopia,Google Play
the ask does work when the phones developer option is turned on it always asks me to turn off the developer options to open the ask please fix it as it is unnecessary,4,2025-01-26,Commercial Bank of Ethiopia,Google Play
wow amazing ape,4,2025-01-26,Commercial Bank of Ethiopia,Google Play
wood ape,2,2025-01-25,Commercial Bank of Ethiopia,Google Play
why on earth is be telling me to turn off developer mode as the name clearly states it for developers not for be to dictate there are countless financial apes out there that work just fine without demanding such an unnecessary restriction if your ape can handle developer mode that you problem fix your code instead of disabling features that have absolutely nothing to do with you,2,2025-01-25,Commercial Bank of Ethiopia,Google Play
it keeps asking for an update recursively since the last update what is going on,2,2025-01-25,Commercial Bank of Ethiopia,Google Play
don't want to update,5,2025-01-25,Commercial Bank of Ethiopia,Google Play
the or code scans must be backed to see the transfer is done and to use it easily,2,2025-01-25,Commercial Bank of Ethiopia,Google Play
nice ape thanks be,5,2025-01-25,Commercial Bank of Ethiopia,Google Play
it is very nice to use,5,2025-01-25,Commercial Bank of Ethiopia,Google Play
the developer mode need to be fixed it sucks,2,2025-01-25,Commercial Bank of Ethiopia,Google Play
the ape is simply trash the only thing that keeping them afloat is that the woods for the other ethiopian banks is even trashier,1,2025-01-25,Commercial Bank of Ethiopia,Google Play
it very important ape,5,2025-01-25,Commercial Bank of Ethiopia,Google Play
this ape after update they ask verification why they restricted for update,5,2025-01-24,Commercial Bank of Ethiopia,Google Play
best and ease to use,5,2025-01-24,Commercial Bank of Ethiopia,Google Play
thank you very much and we are very very happy with your service,5,2025-01-24,Commercial Bank of Ethiopia,Google Play
be is the leader bank in ethiopia by digital payment system,5,2025-01-24,Commercial Bank of Ethiopia,Google Play
it not working properly,1,2025-01-24,Commercial Bank of Ethiopia,Google Play
make an option to send statement by email,1,2025-01-24,Commercial Bank of Ethiopia,Google Play
it is simple and very accurate system,1,2025-01-24,Commercial Bank of Ethiopia,Google Play
am happy for using be how ever am happy we can not send money to other tell birr by this ape why,5,2025-01-24,Commercial Bank of Ethiopia,Google Play
why developer option is off please remove this feature,4,2025-01-24,Commercial Bank of Ethiopia,Google Play
reminding me to update and pay every month,5,2025-01-23,Commercial Bank of Ethiopia,Google Play
after recent update this ape stopped working with message the developer turned off advanced et,3,2025-01-23,Commercial Bank of Ethiopia,Google Play
am students of accounting and finance when graduate wish to do in be thanks,5,2025-01-23,Commercial Bank of Ethiopia,Google Play
wow what can say thank you,5,2025-01-23,Commercial Bank of Ethiopia,Google Play
good ape,5,2025-01-23,Commercial Bank of Ethiopia,Google Play
very inconvenience to use unreliable and needs upgrades,1,2025-01-23,Commercial Bank of Ethiopia,Google Play
the worst bank in ethiopia,1,2025-01-22,Commercial Bank of Ethiopia,Google Play
have been accessing my be from abroad very easily without problems good job guy,2,2025-01-22,Commercial Bank of Ethiopia,Google Play
why force disable developer options in the latest update get that it security precaution but it overkill plenty of other financial apes do not require it and it sometimes necessary for debugging experimental reasons,1,2025-01-21,Commercial Bank of Ethiopia,Google Play
the ape resets without customer interaction or confirmation which is concerning please improve the user experience to ensure better control and transparency for customers,5,2025-01-20,Commercial Bank of Ethiopia,Google Play
it was very convenient and cool to use but for some reason it has been working for me lately,1,2025-01-20,Commercial Bank of Ethiopia,Google Play
censor,5,2025-01-19,Commercial Bank of Ethiopia,Google Play
breaks after week,1,2025-01-19,Commercial Bank of Ethiopia,Google Play
jest like this ape easy and fast,4,2025-01-19,Commercial Bank of Ethiopia,Google Play
first,5,2025-01-18,Commercial Bank of Ethiopia,Google Play
reliable simplified service,5,2025-01-18,Commercial Bank of Ethiopia,Google Play
this application is an unreliable application please do not use it hackers will enter through the application and take the certificate from be,1,2025-01-18,Commercial Bank of Ethiopia,Google Play
good ape,5,2025-01-18,Commercial Bank of Ethiopia,Google Play
please make it active it is delaying in low connection thanks,5,2025-01-18,Commercial Bank of Ethiopia,Google Play
best ape for android user,5,2025-01-18,Commercial Bank of Ethiopia,Google Play
excellent condition security code used,5,2025-01-18,Commercial Bank of Ethiopia,Google Play
yeah its very important in our daily life,5,2025-01-17,Commercial Bank of Ethiopia,Google Play
the new update is seems force enable developer options on setting and please fix the problem on phones it only works for few days every time it get maintained at branches,1,2025-01-17,Commercial Bank of Ethiopia,Google Play
the great ape and banking system,5,2025-01-16,Commercial Bank of Ethiopia,Google Play
money transfer options is not giving correct input and there is no way of knowing whether the money was successfully transferred,2,2025-01-16,Commercial Bank of Ethiopia,Google Play
enabled two step verification when press authenticate it says authentication failed,5,2025-01-15,Commercial Bank of Ethiopia,Google Play
very much helpful,5,2025-01-15,Commercial Bank of Ethiopia,Google Play
it simplify every step,5,2025-01-15,Commercial Bank of Ethiopia,Google Play
it good ape,5,2025-01-15,Commercial Bank of Ethiopia,Google Play
keep up guys you re always trustful service giver appreciated so much,5,2025-01-14,Commercial Bank of Ethiopia,Google Play
this ape is the worst the current release does work when developers mode is on and the transaction errors make you transfer money twice with errors,1,2025-01-13,Commercial Bank of Ethiopia,Google Play
it is nice but some times details of credited amount not shown from whom sent,4,2025-01-12,Commercial Bank of Ethiopia,Google Play
am facing difficulties related to network issues while have good internet connection,1,2025-01-11,Commercial Bank of Ethiopia,Google Play
how to make developer mode off,5,2025-01-11,Commercial Bank of Ethiopia,Google Play
alert the device developer mode is turned on you can use this ape please turn off developer mode and try again ok why reason,1,2025-01-11,Commercial Bank of Ethiopia,Google Play
af we the ga,2,2025-01-09,Commercial Bank of Ethiopia,Google Play
good be ape but it frequently need update after you update you will go to the bank officer for verification but my question is why not verify own self,2,2025-01-09,Commercial Bank of Ethiopia,Google Play
best and easy to use,5,2025-01-09,Commercial Bank of Ethiopia,Google Play
first this ape was pretty good and well connection while transferring money but now there no such worst mob ape ever while transferring money it corrupts due to the network and took the amount of money you were transferring from your account then after seconds interruptions it shows that the money is transferred this case happens especially to telebirrr wallet then after you report the issue to the be customer service they refund your money to your be account after days,2,2025-01-09,Commercial Bank of Ethiopia,Google Play
satisfied,5,2025-01-08,Commercial Bank of Ethiopia,Google Play
it nice but some connection limitation,3,2025-01-08,Commercial Bank of Ethiopia,Google Play
it is good ape but not have statement week month only days and it is not order by time,5,2025-01-08,Commercial Bank of Ethiopia,Google Play
this ape is very good,5,2025-01-08,Commercial Bank of Ethiopia,Google Play
it fast and satisfied,5,2025-01-08,Commercial Bank of Ethiopia,Google Play
best ape for the bank,5,2025-01-08,Commercial Bank of Ethiopia,Google Play
best ape was but the message updated and it refused to work for me,5,2025-01-07,Commercial Bank of Ethiopia,Google Play
more,5,2025-01-07,Commercial Bank of Ethiopia,Google Play
why do have to close the developer option to use it after the update it not even working unless close the developer option,1,2025-01-07,Commercial Bank of Ethiopia,Google Play
attractive and easy to use,5,2025-01-07,Commercial Bank of Ethiopia,Google Play
you can not track your transaction history with correct date time and order,1,2025-01-07,Commercial Bank of Ethiopia,Google Play
keep saying unable to connect after normal phone update please update the ape to match latest phone updates,1,2025-01-07,Commercial Bank of Ethiopia,Google Play
it simple and easy to use,1,2025-01-06,Commercial Bank of Ethiopia,Google Play
like this ape,5,2025-01-06,Commercial Bank of Ethiopia,Google Play
thank you free years,4,2025-01-06,Commercial Bank of Ethiopia,Google Play
please add dark theme,1,2025-01-06,Commercial Bank of Ethiopia,Google Play
good service,5,2025-01-06,Commercial Bank of Ethiopia,Google Play
don understand the reason why this ape asks me to turn off my developer options whenever try to log into the ape this issue immediately needs to be fixed why would sacrifice my phone performance to use only this ape it ridiculous,2,2025-01-06,Commercial Bank of Ethiopia,Google Play
teaching years,5,2025-01-06,Commercial Bank of Ethiopia,Google Play
have been using it for years and it is beautiful in the time have been using it,1,2025-01-06,Commercial Bank of Ethiopia,Google Play
flexible easy service,4,2025-01-05,Commercial Bank of Ethiopia,Google Play
not functional when need transactions,1,2025-01-05,Commercial Bank of Ethiopia,Google Play
the banks logo the hidden accounts data are not seen it is saying it saying unconnected and hence does not sync,2,2025-01-05,Commercial Bank of Ethiopia,Google Play
is not working for last update,1,2025-01-05,Commercial Bank of Ethiopia,Google Play
why is it asking me for developer option,1,2025-01-05,Commercial Bank of Ethiopia,Google Play
we need more update soon once updated it it automatically stop working,1,2025-01-05,Commercial Bank of Ethiopia,Google Play
very slavish to operate needs upgraded,2,2025-01-05,Commercial Bank of Ethiopia,Google Play
was for use,5,2025-01-04,Commercial Bank of Ethiopia,Google Play
it nice apes,2,2025-01-04,Commercial Bank of Ethiopia,Google Play
it gives service great,5,2025-01-04,Commercial Bank of Ethiopia,Google Play
why did this application stopped working at the moment,1,2025-01-04,Commercial Bank of Ethiopia,Google Play
the worst update seen in the bank industry for mobile banking if you re unable to make it smooth and reliable at the same time return it to previous version it shows that you don have the best expertise like other banks in the country,1,2025-01-04,Commercial Bank of Ethiopia,Google Play
it very good fast service provider but at the moment the system is denying me,5,2025-01-04,Commercial Bank of Ethiopia,Google Play
it is fine,5,2025-01-04,Commercial Bank of Ethiopia,Google Play
year,3,2025-01-03,Commercial Bank of Ethiopia,Google Play
very good ape forever,5,2025-01-03,Commercial Bank of Ethiopia,Google Play
thank for the easy operating service it made life simple and accurate keep it up,4,2025-01-03,Commercial Bank of Ethiopia,Google Play
this ape the best one,5,2025-01-03,Commercial Bank of Ethiopia,Google Play
developer option,2,2025-01-03,Commercial Bank of Ethiopia,Google Play
it not working,1,2025-01-03,Commercial Bank of Ethiopia,Google Play
how can device developer mood off,5,2025-01-03,Commercial Bank of Ethiopia,Google Play
years,5,2025-01-03,Commercial Bank of Ethiopia,Google Play
wat is problem,5,2025-01-03,Commercial Bank of Ethiopia,Google Play
commercial bank,4,2025-01-02,Commercial Bank of Ethiopia,Google Play
what your problem with developer option,1,2025-01-02,Commercial Bank of Ethiopia,Google Play
can access this ape without turning off the developer option mode,1,2025-01-02,Commercial Bank of Ethiopia,Google Play
always their is man function,1,2025-01-02,Commercial Bank of Ethiopia,Google Play
it slow and unused ape,1,2025-01-02,Commercial Bank of Ethiopia,Google Play
no speed to reload,5,2025-01-02,Commercial Bank of Ethiopia,Google Play
thanks for your,5,2025-01-02,Commercial Bank of Ethiopia,Google Play
its not opening,5,2025-01-02,Commercial Bank of Ethiopia,Google Play
very nice and fast ape,5,2025-01-01,Commercial Bank of Ethiopia,Google Play
simple bug fix would help if current exchange rate is displayed on the ape,4,2025-01-01,Commercial Bank of Ethiopia,Google Play
the not allowing the ape while developer options is on needs to be fixed why the hell is an ape telling me what to do with my own os this is an unnecessary fix that needs to be fixed,1,2025-01-01,Commercial Bank of Ethiopia,Google Play
the recent update automatically turns the developers option on and when one starts the ape message pops up saying the ape does not work with the developers option on so one has to go to the settings and manually turn the developers option off otherwise the ape does work,3,2025-01-01,Commercial Bank of Ethiopia,Google Play
very useful ape,2,2025-01-01,Commercial Bank of Ethiopia,Google Play
when after updating the ape it asked me to turn off developer mode how do do that,4,2025-01-01,Commercial Bank of Ethiopia,Google Play
that good for me,4,2025-01-01,Commercial Bank of Ethiopia,Google Play
working doing vastly,5,2025-01-01,Commercial Bank of Ethiopia,Google Play
the poorest ape,4,2025-01-01,Commercial Bank of Ethiopia,Google Play
the inconvenience of this ape is that it requires developer options to be turned off this hinders my ability to customize my phone as some of the customization can only be done in the developer options also it did have this requirement before so why now and please return it how it was because this should not be an issue also when transaction is completed before it used to allow me to save the image of the completed transaction now it does so please fix that also,1,2025-01-01,Commercial Bank of Ethiopia,Google Play
smart ape,5,2025-01-01,Commercial Bank of Ethiopia,Google Play
worst update ever it asked to disable the developer option which they don have any authority over most useless update ever wish could give it star if it was possible why do you care about my phone settings stupid developers should switch to other banks,1,2025-01-01,Commercial Bank of Ethiopia,Google Play
muftearashide,5,2025-01-01,Commercial Bank of Ethiopia,Google Play
wow wonderful ape thank you so much,4,2025-01-01,Commercial Bank of Ethiopia,Google Play
it ask me your developer mode is on and its not working for me,1,2025-01-01,Commercial Bank of Ethiopia,Google Play
the last update is useless,1,2024-12-31,Commercial Bank of Ethiopia,Google Play
it is vary good,5,2024-12-31,Commercial Bank of Ethiopia,Google Play
security,1,2024-12-31,Commercial Bank of Ethiopia,Google Play
like you this ape,5,2024-12-31,Commercial Bank of Ethiopia,Google Play
its good ape,1,2024-12-31,Commercial Bank of Ethiopia,Google Play
it is and better than,5,2024-12-31,Commercial Bank of Ethiopia,Google Play
the update in working,1,2024-12-31,Commercial Bank of Ethiopia,Google Play
as an ape developer rely on developer mode to build and test apes but this ape blocks access entirely if it enabled this restriction is unnecessary and makes it impossible for developers to use the service instead of outright blocking consider implementing enhanced security measures that don alienate professionals who need this setting please reconsider this policy,2,2024-12-31,Commercial Bank of Ethiopia,Google Play
it really helpful,1,2024-12-31,Commercial Bank of Ethiopia,Google Play
no work on my device,5,2024-12-31,Commercial Bank of Ethiopia,Google Play
not convince in slow no,5,2024-12-31,Commercial Bank of Ethiopia,Google Play
weak update it stops when want to set two step verification on and it is only applicable if developer options are on why please tell me the reason,1,2024-12-31,Commercial Bank of Ethiopia,Google Play
why not used on these devices,5,2024-12-30,Commercial Bank of Ethiopia,Google Play
updates went to dismiss the developer option,2,2024-12-30,Commercial Bank of Ethiopia,Google Play
best mobile banking ape moreover will rate stars as soon as you add account statement display menu in it hopefully waiting thank you in advance,4,2024-12-30,Commercial Bank of Ethiopia,Google Play
even it is problem to update the ape fix the issue first,1,2024-12-30,Commercial Bank of Ethiopia,Google Play
god apples,5,2024-12-30,Commercial Bank of Ethiopia,Google Play
the review page keeps loading and even sync is completed the history page always shows old unknown transactions edited guess the loading page means it expires and needs to go to the nearest bank and ask for an extension for another years upgrade to stars,3,2024-12-30,Commercial Bank of Ethiopia,Google Play
simple easy platform,5,2024-12-30,Commercial Bank of Ethiopia,Google Play
more than years,5,2024-12-30,Commercial Bank of Ethiopia,Google Play
years ecxepiranes,5,2024-12-29,Commercial Bank of Ethiopia,Google Play
best ape from any others ape,5,2024-12-29,Commercial Bank of Ethiopia,Google Play
it very simple and useful for customer and also easier from other options of this bank but its hard sometimes when the net work is busy and inquiry some add update from the branch technical stuff when you want this application for critical case the application was inquiring you in wanted update,5,2024-12-29,Commercial Bank of Ethiopia,Google Play
this ape is best if you add fingerprint or facial authentication instead of the current one,5,2024-12-29,Commercial Bank of Ethiopia,Google Play
like this application,4,2024-12-29,Commercial Bank of Ethiopia,Google Play
best quality service,5,2024-12-29,Commercial Bank of Ethiopia,Google Play
your service is very very nice,5,2024-12-29,Commercial Bank of Ethiopia,Google Play
the worst ape have ever seen,1,2024-12-28,Commercial Bank of Ethiopia,Google Play
it is best duplication which real on,5,2024-12-28,Commercial Bank of Ethiopia,Google Play
why we can make transfer with foreign banks,1,2024-12-28,Commercial Bank of Ethiopia,Google Play
the worst update,1,2024-12-28,Commercial Bank of Ethiopia,Google Play
looks great but it has no option for accessing our transaction history for some days back this makes our work bad,5,2024-12-27,Commercial Bank of Ethiopia,Google Play
everything is good except that it asking me for update too much even though updated the ape many times and still mentioning that it is critical update so plus fix that,4,2024-12-27,Commercial Bank of Ethiopia,Google Play
difficult to update,1,2024-12-27,Commercial Bank of Ethiopia,Google Play
you should be boa the ape active by self so please arrange now and for activation service was pay birr this is unfair,1,2024-12-27,Commercial Bank of Ethiopia,Google Play
simplest ape that have ever used,5,2024-12-27,Commercial Bank of Ethiopia,Google Play
this ape is the best easy and more clear to use including its features to understand so liked it because the ape made the life of customers easy thanks be and the ape,5,2024-12-27,Commercial Bank of Ethiopia,Google Play
