review,rating,date,bank,source
am not exaggerating when say that this application is one of the biggest players in the banking industry it has simplified lot of things for the user even if the bank is in his pocket but my opinion is when we transfer money there is word limit on the note at the end why can we write our reason briefly don understand why it is limited on the other hand there is no limit on the bank could you explain this when we pay for water why is the code not mentioned,5,2025-03-29,Commercial Bank of Ethiopia,Google Play
in this update why screenshoot is disabled now it not working,1,2025-03-28,Commercial Bank of Ethiopia,Google Play
really don't seen like this application fast safe and comfortable,5,2025-03-28,Commercial Bank of Ethiopia,Google Play
excellent but needed upgrading,5,2025-03-28,Commercial Bank of Ethiopia,Google Play
goods ape place update this apes,4,2025-03-28,Commercial Bank of Ethiopia,Google Play
the latest update prevents taking screenshots which is really annoying please allow us to take screenshots we need it for evidence particularly in case of transfer failure,1,2025-03-27,Commercial Bank of Ethiopia,Google Play
fantastic ape appreciate it very much,5,2025-03-27,Commercial Bank of Ethiopia,Google Play
does work properly it crashes some many times commercial bank of ethiopia not only the application but also sending money to own be birr does get your money in your bank account forcefully you must wait days to get your money back to your account walk up be the world is going to decentralized finance,1,2025-03-26,Commercial Bank of Ethiopia,Google Play
it crashes multiple times overtime you launch it fix it edit crash fixed but screenshots has been disabled don know who thought this was good idea,1,2025-03-26,Commercial Bank of Ethiopia,Google Play
why why remove screen shoot,2,2025-03-26,Commercial Bank of Ethiopia,Google Play
fails mid transaction no screenshot download don work link shared not working bring back the old ape this is unless,1,2025-03-26,Commercial Bank of Ethiopia,Google Play
very nice one,5,2025-03-26,Commercial Bank of Ethiopia,Google Play
good application,5,2025-03-25,Commercial Bank of Ethiopia,Google Play
problem solver and the best fast ape,5,2025-03-25,Commercial Bank of Ethiopia,Google Play
please bring back the screenshot option the screenshot download option takes like second appear in gallery and most people don know about it,3,2025-03-25,Commercial Bank of Ethiopia,Google Play
thank you,5,2025-03-25,Commercial Bank of Ethiopia,Google Play
be,5,2025-03-25,Commercial Bank of Ethiopia,Google Play
very nice and convenient ape,5,2025-03-24,Commercial Bank of Ethiopia,Google Play
there are to many bugs ape keeps crash no and the update file seems to keep getting worse,2,2025-03-24,Commercial Bank of Ethiopia,Google Play
great experience so far but why this ape ain working while developer mode is on,4,2025-03-24,Commercial Bank of Ethiopia,Google Play
why did the screen shot stopped,3,2025-03-24,Commercial Bank of Ethiopia,Google Play
it very good application but sometimes it takes long time to synchronize,4,2025-03-23,Commercial Bank of Ethiopia,Google Play
to getting money,5,2025-03-23,Commercial Bank of Ethiopia,Google Play
some times it is difficult to get receipts for the payment made,1,2025-03-23,Commercial Bank of Ethiopia,Google Play
this ape is best,1,2025-03-23,Commercial Bank of Ethiopia,Google Play
it very useful,5,2025-03-23,Commercial Bank of Ethiopia,Google Play
best ape and update more features,5,2025-03-23,Commercial Bank of Ethiopia,Google Play
best ape for this vast digital financial word,5,2025-03-23,Commercial Bank of Ethiopia,Google Play
this ape is my favorite application,5,2025-03-23,Commercial Bank of Ethiopia,Google Play
hook love this application,5,2025-03-22,Commercial Bank of Ethiopia,Google Play
the ape protects me from screenshot after update please make revision on the ape,4,2025-03-22,Commercial Bank of Ethiopia,Google Play
screenshot or slip not working,2,2025-03-22,Commercial Bank of Ethiopia,Google Play
thank you for help,5,2025-03-22,Commercial Bank of Ethiopia,Google Play
sad guys what are you doing why did you add the screenshot restriction to the ape you just made it worse it was great value to us you need to rethink it will change the star rating when you resolve the issue,1,2025-03-22,Commercial Bank of Ethiopia,Google Play
this is helpful and have good and easy for mobile money usage in ethiopia,5,2025-03-22,Commercial Bank of Ethiopia,Google Play
thank you,5,2025-03-22,Commercial Bank of Ethiopia,Google Play
good ape,5,2025-03-22,Commercial Bank of Ethiopia,Google Play
old version was very friendly to use now we can see the reason the transaction history very limited and now it crash every time it opened more over the last update prevents us from taking screenshots thanks for the developers as they are getting more stupid than ever,1,2025-03-21,Commercial Bank of Ethiopia,Google Play
since last week this ape has started not working it simply log in without network but can sync please fix it,5,2025-03-21,Commercial Bank of Ethiopia,Google Play
what an absolutely terrible update no screenshots and you still have this stupid restriction on developer options what about those of us who are actually developers at this point telebirr just wins the game be do better,1,2025-03-21,Commercial Bank of Ethiopia,Google Play
wow its my in,5,2025-03-21,Commercial Bank of Ethiopia,Google Play
in the lasted update you removed the capability to screenshot transactions,3,2025-03-21,Commercial Bank of Ethiopia,Google Play
how do you disable screenshots on banking ape you are very unserious people,1,2025-03-21,Commercial Bank of Ethiopia,Google Play
no screenshot and biometrics on this version work,3,2025-03-21,Commercial Bank of Ethiopia,Google Play
not good too lame to use,1,2025-03-21,Commercial Bank of Ethiopia,Google Play
be ape is great,5,2025-03-20,Commercial Bank of Ethiopia,Google Play
its good and saving time,5,2025-03-20,Commercial Bank of Ethiopia,Google Play
this new update mar is great in fixing bugs stability and smooth experience all give that but it came with big shortcoming which is not allowing to take screenshot can screenshot neither my balance nor the transaction or anything within the ape understand it for security reasons but please bring that back allow us to take screenshot we need that thanks,4,2025-03-20,Commercial Bank of Ethiopia,Google Play
what went wrong could take screenshot,3,2025-03-20,Commercial Bank of Ethiopia,Google Play
ape is crushing recently please update,4,2025-03-20,Commercial Bank of Ethiopia,Google Play
it is good but why screenshot is forbidden,4,2025-03-20,Commercial Bank of Ethiopia,Google Play
taking away the screenshot of the receipt is just silly worse is the download button putting copy of the screenshot which you prevented to be taken in the downloads folder where we cant attach directly from whatsapp millions of people use the screenshot as proof of payment transfer yet you make that harder for everyone have every user contacts the developer or manager who made this awful decision,1,2025-03-20,Commercial Bank of Ethiopia,Google Play
very good ape,5,2025-03-20,Commercial Bank of Ethiopia,Google Play
new update version keeps crashing it needs maintenance,3,2025-03-19,Commercial Bank of Ethiopia,Google Play
the update is unneeded,1,2025-03-19,Commercial Bank of Ethiopia,Google Play
as if the update of march can take screenshot in the ape can just save it as file and that is so annoying used to save all screenshot in my gallery in one folder now with the extra steps added have to save the file go to file and then screenshot it the solution is to allow the screenshot to be save in to gallery automatically wish you give this review attention and resolve the issue shortly,2,2025-03-19,Commercial Bank of Ethiopia,Google Play
it is good ape but when make inter bank transaction it can display the receiver account number and name of receiver and also receiver bank,4,2025-03-19,Commercial Bank of Ethiopia,Google Play
it was nice but now it dose not opened the transactions,5,2025-03-18,Commercial Bank of Ethiopia,Google Play
the apes is good to use,5,2025-03-17,Commercial Bank of Ethiopia,Google Play
it best ape but please add included payment of water bill,4,2025-03-17,Commercial Bank of Ethiopia,Google Play
the ape has bug and it keeps crashing please provide an update and fix the issue thank you,3,2025-03-17,Commercial Bank of Ethiopia,Google Play
this is my favorite ape,5,2025-03-17,Commercial Bank of Ethiopia,Google Play
we can get mobile token on be ape or any other online this is need to improve internet banking is always say authenticate error after some weeks this is need to improve,4,2025-03-16,Commercial Bank of Ethiopia,Google Play
excellent ape for account transaction specially for business customers and good method to pay bills and different personal payment,5,2025-03-15,Commercial Bank of Ethiopia,Google Play
the ape has brought new problem when open the ape it closes itself then have to open it again please fix this issue if it your problem,3,2025-03-14,Commercial Bank of Ethiopia,Google Play
in my view can give any conclusion because it the starting of an online banking in my country however the commercial bank of ethiopia must rebuild this ape and also need to make more access to changing the system keep continuing ethiopia,5,2025-03-14,Commercial Bank of Ethiopia,Google Play
very attractive and user friendly,5,2025-03-13,Commercial Bank of Ethiopia,Google Play
good apes,5,2025-03-13,Commercial Bank of Ethiopia,Google Play
my special ape and my proud bank of ethiopia,5,2025-03-13,Commercial Bank of Ethiopia,Google Play
the ape need update it always crash,1,2025-03-13,Commercial Bank of Ethiopia,Google Play
it is very comfortable and simple to use but what standing order is not work,5,2025-03-13,Commercial Bank of Ethiopia,Google Play
one of the best apes have used,5,2025-03-13,Commercial Bank of Ethiopia,Google Play
am appreciate this ape,5,2025-03-13,Commercial Bank of Ethiopia,Google Play
very happy using this ape thanks to developers,5,2025-03-12,Commercial Bank of Ethiopia,Google Play
be birr ape is my best choice,5,2025-03-12,Commercial Bank of Ethiopia,Google Play
exceptional incredible,5,2025-03-12,Commercial Bank of Ethiopia,Google Play
joyful ape,5,2025-03-11,Commercial Bank of Ethiopia,Google Play
unsatisfied with the new update keeps crashing every now and then and even though haven reached the max ten per day still refuses to transfer probably going to change my bank if it not fixed asap,1,2025-03-10,Commercial Bank of Ethiopia,Google Play
it is one of the disappointed bank you don suppose to include ethiopian on your name you don deserve it,1,2025-03-10,Commercial Bank of Ethiopia,Google Play
simple and easy to use,5,2025-03-10,Commercial Bank of Ethiopia,Google Play
it not good ape,5,2025-03-10,Commercial Bank of Ethiopia,Google Play
have been using be ape for long but recently it has started crashing repeatedly and even my phone is reporting that the ape has bugs and tells me to wait the developer to fix these bugs,1,2025-03-09,Commercial Bank of Ethiopia,Google Play
the great ape be,5,2025-03-09,Commercial Bank of Ethiopia,Google Play
why it asks me update repeatedly as soon as download it,1,2025-03-09,Commercial Bank of Ethiopia,Google Play
commercial bank rate this,5,2025-03-08,Commercial Bank of Ethiopia,Google Play
it is good for many aspect if can get transactions report with time duration periodically,3,2025-03-07,Commercial Bank of Ethiopia,Google Play
best performing ape,5,2025-03-07,Commercial Bank of Ethiopia,Google Play
best back in ethiopia,5,2025-03-06,Commercial Bank of Ethiopia,Google Play
two step verification update is fake meaningless why because the ape gives you an option of to use pin while requesting two step verification step this updated ape is not differ than the previous one in case of security safeguarding users the other features of the ape are best and easy to use it,1,2025-03-06,Commercial Bank of Ethiopia,Google Play
its good,5,2025-03-05,Commercial Bank of Ethiopia,Google Play
why don install,5,2025-03-05,Commercial Bank of Ethiopia,Google Play
glad to use it,5,2025-03-05,Commercial Bank of Ethiopia,Google Play
very good thank you,5,2025-03-04,Commercial Bank of Ethiopia,Google Play
have been customer of the commercial bank of ethiopia for many years,5,2025-03-03,Commercial Bank of Ethiopia,Google Play
we need this ape to work properly and it looks like an outdated,2,2025-03-03,Commercial Bank of Ethiopia,Google Play
the ape crashes too many times it buggy ape,1,2025-03-03,Commercial Bank of Ethiopia,Google Play
thank,5,2025-03-02,Commercial Bank of Ethiopia,Google Play
very good it is easy to use anything,5,2025-03-01,Commercial Bank of Ethiopia,Google Play
its good,5,2025-03-01,Commercial Bank of Ethiopia,Google Play
so slow with internet,1,2025-03-01,Commercial Bank of Ethiopia,Google Play
phone ape is not working,2,2025-03-01,Commercial Bank of Ethiopia,Google Play
it very useful apes,5,2025-03-01,Commercial Bank of Ethiopia,Google Play
it is better ape,5,2025-03-01,Commercial Bank of Ethiopia,Google Play
good work very important,5,2025-03-01,Commercial Bank of Ethiopia,Google Play
it is extent ape it is helpful,5,2025-02-28,Commercial Bank of Ethiopia,Google Play
it don work,1,2025-02-28,Commercial Bank of Ethiopia,Google Play
bad security,2,2025-02-28,Commercial Bank of Ethiopia,Google Play
it shame it can perform well you guys can even fix bug it getting unusable shame shame shame,1,2025-02-28,Commercial Bank of Ethiopia,Google Play
easy to use and efferent system,5,2025-02-28,Commercial Bank of Ethiopia,Google Play
great,5,2025-02-28,Commercial Bank of Ethiopia,Google Play
it is good but can not install the ape why and the other one is it is better to show the earliest transactions for instance before days ago,3,2025-02-27,Commercial Bank of Ethiopia,Google Play
have been using the ape since it is first released and it has been nice but the latest update are very worse the ape crashes frequently and drains battery highly,3,2025-02-27,Commercial Bank of Ethiopia,Google Play
commercial bank and it mobile banking is very good,5,2025-02-27,Commercial Bank of Ethiopia,Google Play
friendly mobile banking application,5,2025-02-27,Commercial Bank of Ethiopia,Google Play
vary good,5,2025-02-27,Commercial Bank of Ethiopia,Google Play
star because have to visit my bank for new installation of the ape and reactivation takes about to minutes with there long queue and system failures learn from televise ape and give options to customers to apt out of this ridiculous security feature second why is there no customization in the settings for displaying which account want displayed in the first section rather that slide to my main account every time you are making us pay monthly subscription bare minimum is not it,1,2025-02-26,Commercial Bank of Ethiopia,Google Play
recently it is not working please check it,2,2025-02-26,Commercial Bank of Ethiopia,Google Play
this ape,5,2025-02-26,Commercial Bank of Ethiopia,Google Play
it is user friendly excellent ape,5,2025-02-26,Commercial Bank of Ethiopia,Google Play
simple and efficient,5,2025-02-26,Commercial Bank of Ethiopia,Google Play
it is better to use and save time truly appreciate the bank system,5,2025-02-25,Commercial Bank of Ethiopia,Google Play
good work,5,2025-02-25,Commercial Bank of Ethiopia,Google Play
simple and secure ape,5,2025-02-25,Commercial Bank of Ethiopia,Google Play
crashing frequently every time try to log in it so annoying,1,2025-02-25,Commercial Bank of Ethiopia,Google Play
fix the bug so frustrating,3,2025-02-25,Commercial Bank of Ethiopia,Google Play
the ape is full of bugs here and there perhaps it from the backed side ink for instance the transaction history you see on top is one made couple of months ago and you have to refresh until you reach the top it just so bizarre and you can even search for transaction you made someone with lot of transactions will find it annoying even simple things like localizing dates to amharic dates are now correctly implemented,2,2025-02-25,Commercial Bank of Ethiopia,Google Play
good experience,5,2025-02-24,Commercial Bank of Ethiopia,Google Play
my device install up updated all data access all function but can support transaction first login password works but can conformation last transaction password,5,2025-02-24,Commercial Bank of Ethiopia,Google Play
constantly crashing after new update,1,2025-02-24,Commercial Bank of Ethiopia,Google Play
great up simple to use yet has all necessary features,4,2025-02-24,Commercial Bank of Ethiopia,Google Play
nice this is ape,5,2025-02-23,Commercial Bank of Ethiopia,Google Play
why can we use this ape with developer mode turned on when other big international banks apes allow it,1,2025-02-22,Commercial Bank of Ethiopia,Google Play
it is good application,4,2025-02-22,Commercial Bank of Ethiopia,Google Play
guys after the last update it crushing lot like lot look in to it,3,2025-02-22,Commercial Bank of Ethiopia,Google Play
the best ape,5,2025-02-22,Commercial Bank of Ethiopia,Google Play
this is good ape,5,2025-02-22,Commercial Bank of Ethiopia,Google Play
it have bug it keeps shut down when open the ape without any notification please fix the bug,3,2025-02-22,Commercial Bank of Ethiopia,Google Play
very best and fast money transferring ape,5,2025-02-22,Commercial Bank of Ethiopia,Google Play
why is it so hard to use this ape why don you make it simple like other apes sometimes it does function right,1,2025-02-22,Commercial Bank of Ethiopia,Google Play
very best ape,5,2025-02-22,Commercial Bank of Ethiopia,Google Play
couldn't update the ape,1,2025-02-22,Commercial Bank of Ethiopia,Google Play
too much commission and service charges not fair at all this is stealing,1,2025-02-21,Commercial Bank of Ethiopia,Google Play
it is easy and user friendly,5,2025-02-21,Commercial Bank of Ethiopia,Google Play
when open the ape it turns off keep says ape has bug the ape needs update,2,2025-02-21,Commercial Bank of Ethiopia,Google Play
solve unwanted time and the time to losses be office,5,2025-02-21,Commercial Bank of Ethiopia,Google Play
faced big problem with this due to developer mode problem how can you help me plus,5,2025-02-21,Commercial Bank of Ethiopia,Google Play
utilizes too much power crashes often,3,2025-02-20,Commercial Bank of Ethiopia,Google Play
most effective so far,5,2025-02-20,Commercial Bank of Ethiopia,Google Play
not working normally,1,2025-02-20,Commercial Bank of Ethiopia,Google Play
this is the simplest bookkeeping system or method like it,5,2025-02-19,Commercial Bank of Ethiopia,Google Play
these days the ape is crashing immediately after login please check,5,2025-02-19,Commercial Bank of Ethiopia,Google Play
gave it be this ape deserves thank you for your services appreciated,5,2025-02-19,Commercial Bank of Ethiopia,Google Play
fantastic and best,5,2025-02-18,Commercial Bank of Ethiopia,Google Play
it lags before showing the transaction and you have to use the one in the sums message why does it work on the ape it just says loading,1,2025-02-18,Commercial Bank of Ethiopia,Google Play
very amazing application,5,2025-02-18,Commercial Bank of Ethiopia,Google Play
easy and fantastic to use,5,2025-02-18,Commercial Bank of Ethiopia,Google Play
the way its menu arranged to use is easy to use,5,2025-02-17,Commercial Bank of Ethiopia,Google Play
its not bad but there are plenty of errors,2,2025-02-17,Commercial Bank of Ethiopia,Google Play
waw fantastic application,5,2025-02-16,Commercial Bank of Ethiopia,Google Play
am satisfied by this a thank you,5,2025-02-16,Commercial Bank of Ethiopia,Google Play
best of the best application for ever,5,2025-02-16,Commercial Bank of Ethiopia,Google Play
this ape is better,5,2025-02-15,Commercial Bank of Ethiopia,Google Play
it very good in reminding the account numbers you have been used but need to show recipient history whenever you want to present it or it has to have search on options for specific time you want to look for receipts with out going for account details at bank if you lost your receipt without downloading it and need to look sometime while you can get in simple search on the ape,1,2025-02-15,Commercial Bank of Ethiopia,Google Play
it is good ape,5,2025-02-15,Commercial Bank of Ethiopia,Google Play
it crashes lot it does work at all sometimes by far it is the worst mobile banking ape have ever used,1,2025-02-15,Commercial Bank of Ethiopia,Google Play
very buggy,2,2025-02-14,Commercial Bank of Ethiopia,Google Play
good apes to save my money withdraw my money to service,5,2025-02-13,Commercial Bank of Ethiopia,Google Play
it easy and good,5,2025-02-13,Commercial Bank of Ethiopia,Google Play
it is best ape,5,2025-02-13,Commercial Bank of Ethiopia,Google Play
it is not functioning most of the time,3,2025-02-13,Commercial Bank of Ethiopia,Google Play
it sends unwanted welcome notification every time you login there is no way that you can disable this,3,2025-02-13,Commercial Bank of Ethiopia,Google Play
this ape now not open what problem please solve it,1,2025-02-13,Commercial Bank of Ethiopia,Google Play
nice thanks,5,2025-02-13,Commercial Bank of Ethiopia,Google Play
it used to be better in the previous but after the recent update it keeps crashing as soon as it logs in it needs to be fixed,1,2025-02-11,Commercial Bank of Ethiopia,Google Play
can even load our transaction history,1,2025-02-11,Commercial Bank of Ethiopia,Google Play
am happy of this ape,5,2025-02-11,Commercial Bank of Ethiopia,Google Play
great ape but try to include an access to water bill payment for places other than adds baba try top the ape not to be inactive while developer option setting in samsung phones is activated,4,2025-02-11,Commercial Bank of Ethiopia,Google Play
very good ape,5,2025-02-10,Commercial Bank of Ethiopia,Google Play
this ape is very useful but sometimes when you want to see specific transactions it did work so that way gave you,3,2025-02-10,Commercial Bank of Ethiopia,Google Play
it not bad,2,2025-02-10,Commercial Bank of Ethiopia,Google Play
it shut down without warning,1,2025-02-10,Commercial Bank of Ethiopia,Google Play
best ape of the bank but when it needs update customer must be notified in my point of view otherwise customers saying mobile banking is not working today is bad motor,5,2025-02-10,Commercial Bank of Ethiopia,Google Play
use this ape all the time on my business but sometimes it is difficult to use in rural areas because there is not enough network so what if you prepared it for the public to use offline,3,2025-02-09,Commercial Bank of Ethiopia,Google Play
this ape is very interesting and simple to use,5,2025-02-09,Commercial Bank of Ethiopia,Google Play
add customer service please other than calling why would you have mobile ape but not an online text based customer service why disappointing and will never use the top up feature again have been trying to recharge my safaricom balance but your ape would say time out and then credit my account but never recharge my balance why where is my money do you expect me to call at midnight,2,2025-02-08,Commercial Bank of Ethiopia,Google Play
smart and easy to use like this ape,5,2025-02-08,Commercial Bank of Ethiopia,Google Play
the best ape love it,5,2025-02-08,Commercial Bank of Ethiopia,Google Play
is not useful,3,2025-02-08,Commercial Bank of Ethiopia,Google Play
it ok,5,2025-02-08,Commercial Bank of Ethiopia,Google Play
it good,5,2025-02-08,Commercial Bank of Ethiopia,Google Play
its good service,4,2025-02-07,Commercial Bank of Ethiopia,Google Play
recent transactions does load properly sometimes and also when transferring to someone sometimes it says failed and but already transferred which might cause to double transfer,1,2025-02-07,Commercial Bank of Ethiopia,Google Play
it used to work properly but not anymore used to use the ape from abroad but these days it kept saying unable to connect when tried to check my balance and do transactions,1,2025-02-07,Commercial Bank of Ethiopia,Google Play
awash birr pro,1,2025-02-07,Commercial Bank of Ethiopia,Google Play
it is very important application,5,2025-02-07,Commercial Bank of Ethiopia,Google Play
to save my time best ape to me like this ape tax be,5,2025-02-07,Commercial Bank of Ethiopia,Google Play
it is shame not to appreciate the recent system improvements that the commercial bank of ethiopia has been making and have no doubt that it will be different from this inshaallah another thing would like to comment on is that the current method for transferring money to telesis can own be sent to the person so it is possible to send money directly from the commercial bank to other banks if you make it possible to transfer money directly to anyone would be very grateful thank you,5,2025-02-06,Commercial Bank of Ethiopia,Google Play
comfortable,5,2025-02-06,Commercial Bank of Ethiopia,Google Play
ape keeps on crashing after the latest update failures are frequent,3,2025-02-05,Commercial Bank of Ethiopia,Google Play
don need to update this ape,5,2025-02-05,Commercial Bank of Ethiopia,Google Play
good work thank you,5,2025-02-05,Commercial Bank of Ethiopia,Google Play
after the new update struggling to use this ape it suddenly crush or close automatically plus fix this problem,1,2025-02-05,Commercial Bank of Ethiopia,Google Play
very fast and easy to use,5,2025-02-05,Commercial Bank of Ethiopia,Google Play
it is best application,5,2025-02-04,Commercial Bank of Ethiopia,Google Play
this apes amazing,5,2025-02-04,Commercial Bank of Ethiopia,Google Play
this ape is just meaningful application for our country,5,2025-02-04,Commercial Bank of Ethiopia,Google Play
